==6487== Memcheck, a memory error detector
==6487== Copyright (C) 2002-2017, and GNU GPL'd, by Julian Seward et al.
==6487== Using Valgrind-3.13.0 and LibVEX; rerun with -h for copyright info
==6487== Command: ./ls -l
==6487== 
==6487== Invalid write of size 1
==6487==    at 0x109DE6: get_mode (ls.c:370)
==6487==    by 0x109D5E: get_stat_out (ls.c:350)
==6487==    by 0x109BB1: output_ent_stats (ls.c:312)
==6487==    by 0x109562: _ls (ls.c:141)
==6487==    by 0x109178: main (ls.c:31)
==6487==  Address 0x52372f0 is 0 bytes after a block of size 800 alloc'd
==6487==    at 0x4C2FB0F: malloc (in /usr/lib/valgrind/vgpreload_memcheck-amd64-linux.so)
==6487==    by 0x109A6B: output_ent_stats (ls.c:287)
==6487==    by 0x109562: _ls (ls.c:141)
==6487==    by 0x109178: main (ls.c:31)
==6487== 
==6487== Invalid write of size 1
==6487==    at 0x109E9C: get_mode (ls.c:384)
==6487==    by 0x109D5E: get_stat_out (ls.c:350)
==6487==    by 0x109BB1: output_ent_stats (ls.c:312)
==6487==    by 0x109562: _ls (ls.c:141)
==6487==    by 0x109178: main (ls.c:31)
==6487==  Address 0x52372f1 is 1 bytes after a block of size 800 alloc'd
==6487==    at 0x4C2FB0F: malloc (in /usr/lib/valgrind/vgpreload_memcheck-amd64-linux.so)
==6487==    by 0x109A6B: output_ent_stats (ls.c:287)
==6487==    by 0x109562: _ls (ls.c:141)
==6487==    by 0x109178: main (ls.c:31)
==6487== 
==6487== Invalid write of size 1
==6487==    at 0x109EBE: get_mode (ls.c:385)
==6487==    by 0x109D5E: get_stat_out (ls.c:350)
==6487==    by 0x109BB1: output_ent_stats (ls.c:312)
==6487==    by 0x109562: _ls (ls.c:141)
==6487==    by 0x109178: main (ls.c:31)
==6487==  Address 0x52372f2 is 2 bytes after a block of size 800 alloc'd
==6487==    at 0x4C2FB0F: malloc (in /usr/lib/valgrind/vgpreload_memcheck-amd64-linux.so)
==6487==    by 0x109A6B: output_ent_stats (ls.c:287)
==6487==    by 0x109562: _ls (ls.c:141)
==6487==    by 0x109178: main (ls.c:31)
==6487== 
==6487== Invalid write of size 1
==6487==    at 0x109EDE: get_mode (ls.c:386)
==6487==    by 0x109D5E: get_stat_out (ls.c:350)
==6487==    by 0x109BB1: output_ent_stats (ls.c:312)
==6487==    by 0x109562: _ls (ls.c:141)
==6487==    by 0x109178: main (ls.c:31)
==6487==  Address 0x52372f3 is 3 bytes after a block of size 800 alloc'd
==6487==    at 0x4C2FB0F: malloc (in /usr/lib/valgrind/vgpreload_memcheck-amd64-linux.so)
==6487==    by 0x109A6B: output_ent_stats (ls.c:287)
==6487==    by 0x109562: _ls (ls.c:141)
==6487==    by 0x109178: main (ls.c:31)
==6487== 
==6487== Invalid write of size 1
==6487==    at 0x109EFE: get_mode (ls.c:387)
==6487==    by 0x109D5E: get_stat_out (ls.c:350)
==6487==    by 0x109BB1: output_ent_stats (ls.c:312)
==6487==    by 0x109562: _ls (ls.c:141)
==6487==    by 0x109178: main (ls.c:31)
==6487==  Address 0x52372f4 is 4 bytes after a block of size 800 alloc'd
==6487==    at 0x4C2FB0F: malloc (in /usr/lib/valgrind/vgpreload_memcheck-amd64-linux.so)
==6487==    by 0x109A6B: output_ent_stats (ls.c:287)
==6487==    by 0x109562: _ls (ls.c:141)
==6487==    by 0x109178: main (ls.c:31)
==6487== 
==6487== Invalid write of size 1
==6487==    at 0x109F1E: get_mode (ls.c:388)
==6487==    by 0x109D5E: get_stat_out (ls.c:350)
==6487==    by 0x109BB1: output_ent_stats (ls.c:312)
==6487==    by 0x109562: _ls (ls.c:141)
==6487==    by 0x109178: main (ls.c:31)
==6487==  Address 0x52372f5 is 5 bytes after a block of size 800 alloc'd
==6487==    at 0x4C2FB0F: malloc (in /usr/lib/valgrind/vgpreload_memcheck-amd64-linux.so)
==6487==    by 0x109A6B: output_ent_stats (ls.c:287)
==6487==    by 0x109562: _ls (ls.c:141)
==6487==    by 0x109178: main (ls.c:31)
==6487== 
==6487== Invalid write of size 1
==6487==    at 0x109F3E: get_mode (ls.c:389)
==6487==    by 0x109D5E: get_stat_out (ls.c:350)
==6487==    by 0x109BB1: output_ent_stats (ls.c:312)
==6487==    by 0x109562: _ls (ls.c:141)
==6487==    by 0x109178: main (ls.c:31)
==6487==  Address 0x52372f6 is 6 bytes after a block of size 800 alloc'd
==6487==    at 0x4C2FB0F: malloc (in /usr/lib/valgrind/vgpreload_memcheck-amd64-linux.so)
==6487==    by 0x109A6B: output_ent_stats (ls.c:287)
==6487==    by 0x109562: _ls (ls.c:141)
==6487==    by 0x109178: main (ls.c:31)
==6487== 
==6487== Invalid write of size 1
==6487==    at 0x109F5E: get_mode (ls.c:390)
==6487==    by 0x109D5E: get_stat_out (ls.c:350)
==6487==    by 0x109BB1: output_ent_stats (ls.c:312)
==6487==    by 0x109562: _ls (ls.c:141)
==6487==    by 0x109178: main (ls.c:31)
==6487==  Address 0x52372f7 is 7 bytes after a block of size 800 alloc'd
==6487==    at 0x4C2FB0F: malloc (in /usr/lib/valgrind/vgpreload_memcheck-amd64-linux.so)
==6487==    by 0x109A6B: output_ent_stats (ls.c:287)
==6487==    by 0x109562: _ls (ls.c:141)
==6487==    by 0x109178: main (ls.c:31)
==6487== 
==6487== Invalid write of size 1
==6487==    at 0x109F7E: get_mode (ls.c:391)
==6487==    by 0x109D5E: get_stat_out (ls.c:350)
==6487==    by 0x109BB1: output_ent_stats (ls.c:312)
==6487==    by 0x109562: _ls (ls.c:141)
==6487==    by 0x109178: main (ls.c:31)
==6487==  Address 0x52372f8 is 8 bytes after a block of size 800 alloc'd
==6487==    at 0x4C2FB0F: malloc (in /usr/lib/valgrind/vgpreload_memcheck-amd64-linux.so)
==6487==    by 0x109A6B: output_ent_stats (ls.c:287)
==6487==    by 0x109562: _ls (ls.c:141)
==6487==    by 0x109178: main (ls.c:31)
==6487== 
==6487== Invalid write of size 1
==6487==    at 0x109F9E: get_mode (ls.c:392)
==6487==    by 0x109D5E: get_stat_out (ls.c:350)
==6487==    by 0x109BB1: output_ent_stats (ls.c:312)
==6487==    by 0x109562: _ls (ls.c:141)
==6487==    by 0x109178: main (ls.c:31)
==6487==  Address 0x52372f9 is 9 bytes after a block of size 800 alloc'd
==6487==    at 0x4C2FB0F: malloc (in /usr/lib/valgrind/vgpreload_memcheck-amd64-linux.so)
==6487==    by 0x109A6B: output_ent_stats (ls.c:287)
==6487==    by 0x109562: _ls (ls.c:141)
==6487==    by 0x109178: main (ls.c:31)
==6487== 
==6487== Invalid write of size 1
==6487==    at 0x109FA8: get_mode (ls.c:393)
==6487==    by 0x109D5E: get_stat_out (ls.c:350)
==6487==    by 0x109BB1: output_ent_stats (ls.c:312)
==6487==    by 0x109562: _ls (ls.c:141)
==6487==    by 0x109178: main (ls.c:31)
==6487==  Address 0x52372fa is 10 bytes after a block of size 800 alloc'd
==6487==    at 0x4C2FB0F: malloc (in /usr/lib/valgrind/vgpreload_memcheck-amd64-linux.so)
==6487==    by 0x109A6B: output_ent_stats (ls.c:287)
==6487==    by 0x109562: _ls (ls.c:141)
==6487==    by 0x109178: main (ls.c:31)
==6487== 
==6487== Invalid write of size 1
==6487==    at 0x4C3678B: memmove (in /usr/lib/valgrind/vgpreload_memcheck-amd64-linux.so)
==6487==    by 0x109FFF: get_nlink (ls.c:398)
==6487==    by 0x109D79: get_stat_out (ls.c:351)
==6487==    by 0x109BB1: output_ent_stats (ls.c:312)
==6487==    by 0x109562: _ls (ls.c:141)
==6487==    by 0x109178: main (ls.c:31)
==6487==  Address 0x52372fb is 11 bytes after a block of size 800 alloc'd
==6487==    at 0x4C2FB0F: malloc (in /usr/lib/valgrind/vgpreload_memcheck-amd64-linux.so)
==6487==    by 0x109A6B: output_ent_stats (ls.c:287)
==6487==    by 0x109562: _ls (ls.c:141)
==6487==    by 0x109178: main (ls.c:31)
==6487== 
==6487== Invalid write of size 8
==6487==    at 0x10A2F4: get_usr (ls.c:452)
==6487==    by 0x109D9A: get_stat_out (ls.c:352)
==6487==    by 0x109BB1: output_ent_stats (ls.c:312)
==6487==    by 0x109562: _ls (ls.c:141)
==6487==    by 0x109178: main (ls.c:31)
==6487==  Address 0x5237310 is 32 bytes before a block of size 560 in arena "client"
==6487== 
==6487== Invalid write of size 2
==6487==    at 0x4C36753: memmove (in /usr/lib/valgrind/vgpreload_memcheck-amd64-linux.so)
==6487==    by 0x10A387: get_size (ls.c:465)
==6487==    by 0x109DC0: get_stat_out (ls.c:356)
==6487==    by 0x109BB1: output_ent_stats (ls.c:312)
==6487==    by 0x109562: _ls (ls.c:141)
==6487==    by 0x109178: main (ls.c:31)
==6487==  Address 0x5237320 is 16 bytes before a block of size 552 alloc'd
==6487==    at 0x4C2FB0F: malloc (in /usr/lib/valgrind/vgpreload_memcheck-amd64-linux.so)
==6487==    by 0x4EBAE49: __fopen_internal (iofopen.c:65)
==6487==    by 0x4EBAE49: fopen@@GLIBC_2.2.5 (iofopen.c:89)
==6487==    by 0x109AB3: output_ent_stats (ls.c:293)
==6487==    by 0x109562: _ls (ls.c:141)
==6487==    by 0x109178: main (ls.c:31)
==6487== 
==6487== 
==6487== Process terminating with default action of signal 11 (SIGSEGV)
==6487==  Access not within mapped region at address 0xA4DFD48
==6487==    at 0x109C7E: output_ent_stats (ls.c:330)
==6487==    by 0x109562: _ls (ls.c:141)
==6487==    by 0x109178: main (ls.c:31)
==6487==  If you believe this happened as a result of a stack
==6487==  overflow in your program's main thread (unlikely but
==6487==  possible), you can try to increase the size of the
==6487==  main thread stack using the --main-stacksize= flag.
==6487==  The main thread stack size used in this run was 8388608.
-rw-r--r-- 1 root 517
-rw-r--r-- 1 root 4720
-rw-r--r-- 1 root 2891
-rwxr-xr-x 1 root 35960
-rw-r--r-- 1 root 13371
-rw-r--r-- 1 root 3491
-rw-r--r-- 1 root 278
-rw-r--r-- 1 root 542
drwxr-xr-x 2 root 7
drwxr-xr-x 2 root 5
==6487== 
==6487== HEAP SUMMARY:
==6487==     in use at exit: 252,028 bytes in 1,918 blocks
==6487==   total heap usage: 2,911 allocs, 993 frees, 339,372 bytes allocated
==6487== 
==6487== 0 bytes in 11 blocks are indirectly lost in loss record 1 of 76
==6487==    at 0x4C2FB0F: malloc (in /usr/lib/valgrind/vgpreload_memcheck-amd64-linux.so)
==6487==    by 0x4F2A2C2: re_node_set_alloc (regex_internal.c:963)
==6487==    by 0x4F2A2C2: register_state (regex_internal.c:1555)
==6487==    by 0x4F306DC: create_cd_newstate (regex_internal.c:1714)
==6487==    by 0x4F306DC: re_acquire_state_context (regex_internal.c:1534)
==6487==    by 0x4F37A65: create_initial_state (regcomp.c:1043)
==6487==    by 0x4F37A65: re_compile_internal (regcomp.c:804)
==6487==    by 0x4F3D331: regcomp (regcomp.c:498)
==6487==    by 0x10A0E2: get_usr (ls.c:419)
==6487==    by 0x109D9A: get_stat_out (ls.c:352)
==6487==    by 0x109BB1: output_ent_stats (ls.c:312)
==6487==    by 0x109562: _ls (ls.c:141)
==6487==    by 0x109178: main (ls.c:31)
==6487== 
==6487== 0 bytes in 11 blocks are indirectly lost in loss record 2 of 76
==6487==    at 0x4C2FB0F: malloc (in /usr/lib/valgrind/vgpreload_memcheck-amd64-linux.so)
==6487==    by 0x4F2A2C2: re_node_set_alloc (regex_internal.c:963)
==6487==    by 0x4F2A2C2: register_state (regex_internal.c:1555)
==6487==    by 0x4F306DC: create_cd_newstate (regex_internal.c:1714)
==6487==    by 0x4F306DC: re_acquire_state_context (regex_internal.c:1534)
==6487==    by 0x4F37C7C: create_initial_state (regcomp.c:1049)
==6487==    by 0x4F37C7C: re_compile_internal (regcomp.c:804)
==6487==    by 0x4F3D331: regcomp (regcomp.c:498)
==6487==    by 0x10A0E2: get_usr (ls.c:419)
==6487==    by 0x109D9A: get_stat_out (ls.c:352)
==6487==    by 0x109BB1: output_ent_stats (ls.c:312)
==6487==    by 0x109562: _ls (ls.c:141)
==6487==    by 0x109178: main (ls.c:31)
==6487== 
==6487== 44 bytes in 11 blocks are indirectly lost in loss record 3 of 76
==6487==    at 0x4C2FB0F: malloc (in /usr/lib/valgrind/vgpreload_memcheck-amd64-linux.so)
==6487==    by 0x4F2F77A: re_node_set_alloc (regex_internal.c:963)
==6487==    by 0x4F2F77A: calc_eclosure_iter (regcomp.c:1682)
==6487==    by 0x4F2FAF6: calc_eclosure_iter (regcomp.c:1719)
==6487==    by 0x4F37713: calc_eclosure (regcomp.c:1659)
==6487==    by 0x4F37713: analyze (regcomp.c:1186)
==6487==    by 0x4F37713: re_compile_internal (regcomp.c:793)
==6487==    by 0x4F3D331: regcomp (regcomp.c:498)
==6487==    by 0x10A0E2: get_usr (ls.c:419)
==6487==    by 0x109D9A: get_stat_out (ls.c:352)
==6487==    by 0x109BB1: output_ent_stats (ls.c:312)
==6487==    by 0x109562: _ls (ls.c:141)
==6487==    by 0x109178: main (ls.c:31)
==6487== 
==6487== 44 bytes in 11 blocks are indirectly lost in loss record 4 of 76
==6487==    at 0x4C2FB0F: malloc (in /usr/lib/valgrind/vgpreload_memcheck-amd64-linux.so)
==6487==    by 0x4F2F77A: re_node_set_alloc (regex_internal.c:963)
==6487==    by 0x4F2F77A: calc_eclosure_iter (regcomp.c:1682)
==6487==    by 0x4F2FAF6: calc_eclosure_iter (regcomp.c:1719)
==6487==    by 0x4F2FAF6: calc_eclosure_iter (regcomp.c:1719)
==6487==    by 0x4F2FAF6: calc_eclosure_iter (regcomp.c:1719)
==6487==    by 0x4F2FAF6: calc_eclosure_iter (regcomp.c:1719)
==6487==    by 0x4F37713: calc_eclosure (regcomp.c:1659)
==6487==    by 0x4F37713: analyze (regcomp.c:1186)
==6487==    by 0x4F37713: re_compile_internal (regcomp.c:793)
==6487==    by 0x4F3D331: regcomp (regcomp.c:498)
==6487==    by 0x10A0E2: get_usr (ls.c:419)
==6487==    by 0x109D9A: get_stat_out (ls.c:352)
==6487==    by 0x109BB1: output_ent_stats (ls.c:312)
==6487==    by 0x109562: _ls (ls.c:141)
==6487== 
==6487== 44 bytes in 11 blocks are indirectly lost in loss record 5 of 76
==6487==    at 0x4C2FB0F: malloc (in /usr/lib/valgrind/vgpreload_memcheck-amd64-linux.so)
==6487==    by 0x4F2FCE9: re_node_set_init_copy (regex_internal.c:1023)
==6487==    by 0x4F2FCE9: create_ci_newstate (regex_internal.c:1612)
==6487==    by 0x4F2FCE9: re_acquire_state (regex_internal.c:1491)
==6487==    by 0x4F39BBA: add_epsilon_src_nodes (regexec.c:1775)
==6487==    by 0x4F39BBA: update_cur_sifted_state (regexec.c:1739)
==6487==    by 0x4F3A760: sift_states_backward (regexec.c:1567)
==6487==    by 0x4F3C448: prune_impossible_nodes (regexec.c:971)
==6487==    by 0x4F3C448: re_search_internal (regexec.c:811)
==6487==    by 0x4F3D729: regexec@@GLIBC_2.3.4 (regexec.c:220)
==6487==    by 0x10A1AE: get_usr (ls.c:430)
==6487==    by 0x109D9A: get_stat_out (ls.c:352)
==6487==    by 0x109BB1: output_ent_stats (ls.c:312)
==6487==    by 0x109562: _ls (ls.c:141)
==6487==    by 0x109178: main (ls.c:31)
==6487== 
==6487== 44 bytes in 11 blocks are indirectly lost in loss record 6 of 76
==6487==    at 0x4C2FB0F: malloc (in /usr/lib/valgrind/vgpreload_memcheck-amd64-linux.so)
==6487==    by 0x4F2A2C2: re_node_set_alloc (regex_internal.c:963)
==6487==    by 0x4F2A2C2: register_state (regex_internal.c:1555)
==6487==    by 0x4F2FDCC: create_ci_newstate (regex_internal.c:1638)
==6487==    by 0x4F2FDCC: re_acquire_state (regex_internal.c:1491)
==6487==    by 0x4F39BBA: add_epsilon_src_nodes (regexec.c:1775)
==6487==    by 0x4F39BBA: update_cur_sifted_state (regexec.c:1739)
==6487==    by 0x4F3A760: sift_states_backward (regexec.c:1567)
==6487==    by 0x4F3C448: prune_impossible_nodes (regexec.c:971)
==6487==    by 0x4F3C448: re_search_internal (regexec.c:811)
==6487==    by 0x4F3D729: regexec@@GLIBC_2.3.4 (regexec.c:220)
==6487==    by 0x10A1AE: get_usr (ls.c:430)
==6487==    by 0x109D9A: get_stat_out (ls.c:352)
==6487==    by 0x109BB1: output_ent_stats (ls.c:312)
==6487==    by 0x109562: _ls (ls.c:141)
==6487==    by 0x109178: main (ls.c:31)
==6487== 
==6487== 88 bytes in 11 blocks are indirectly lost in loss record 7 of 76
==6487==    at 0x4C31D2F: realloc (in /usr/lib/valgrind/vgpreload_memcheck-amd64-linux.so)
==6487==    by 0x4F2A266: re_node_set_insert (regex_internal.c:1294)
==6487==    by 0x4F2F136: duplicate_node_closure (regcomp.c:1560)
==6487==    by 0x4F2FA5C: calc_eclosure_iter (regcomp.c:1696)
==6487==    by 0x4F37713: calc_eclosure (regcomp.c:1659)
==6487==    by 0x4F37713: analyze (regcomp.c:1186)
==6487==    by 0x4F37713: re_compile_internal (regcomp.c:793)
==6487==    by 0x4F3D331: regcomp (regcomp.c:498)
==6487==    by 0x10A0E2: get_usr (ls.c:419)
==6487==    by 0x109D9A: get_stat_out (ls.c:352)
==6487==    by 0x109BB1: output_ent_stats (ls.c:312)
==6487==    by 0x109562: _ls (ls.c:141)
==6487==    by 0x109178: main (ls.c:31)
==6487== 
==6487== 88 bytes in 22 blocks are indirectly lost in loss record 8 of 76
==6487==    at 0x4C2FB0F: malloc (in /usr/lib/valgrind/vgpreload_memcheck-amd64-linux.so)
==6487==    by 0x4F2A196: re_node_set_init_1 (regex_internal.c:975)
==6487==    by 0x4F2A196: re_node_set_insert (regex_internal.c:1275)
==6487==    by 0x4F2F2F5: duplicate_node_closure (regcomp.c:1520)
==6487==    by 0x4F2FA5C: calc_eclosure_iter (regcomp.c:1696)
==6487==    by 0x4F37713: calc_eclosure (regcomp.c:1659)
==6487==    by 0x4F37713: analyze (regcomp.c:1186)
==6487==    by 0x4F37713: re_compile_internal (regcomp.c:793)
==6487==    by 0x4F3D331: regcomp (regcomp.c:498)
==6487==    by 0x10A0E2: get_usr (ls.c:419)
==6487==    by 0x109D9A: get_stat_out (ls.c:352)
==6487==    by 0x109BB1: output_ent_stats (ls.c:312)
==6487==    by 0x109562: _ls (ls.c:141)
==6487==    by 0x109178: main (ls.c:31)
==6487== 
==6487== 120 bytes in 1 blocks are still reachable in loss record 9 of 76
==6487==    at 0x4C2FB0F: malloc (in /usr/lib/valgrind/vgpreload_memcheck-amd64-linux.so)
==6487==    by 0x10A52A: f_list_init (f_list.c:52)
==6487==    by 0x109435: _ls (ls.c:101)
==6487==    by 0x109178: main (ls.c:31)
==6487== 
==6487== 120 bytes in 1 blocks are definitely lost in loss record 10 of 76
==6487==    at 0x4C2FB0F: malloc (in /usr/lib/valgrind/vgpreload_memcheck-amd64-linux.so)
==6487==    by 0x4EBBB8B: getdelim (iogetdelim.c:62)
==6487==    by 0x10A17B: get_usr (ls.c:428)
==6487==    by 0x109D9A: get_stat_out (ls.c:352)
==6487==    by 0x109BB1: output_ent_stats (ls.c:312)
==6487==    by 0x109562: _ls (ls.c:141)
==6487==    by 0x109178: main (ls.c:31)
==6487== 
==6487== 132 bytes in 22 blocks are indirectly lost in loss record 11 of 76
==6487==    at 0x4C2FB0F: malloc (in /usr/lib/valgrind/vgpreload_memcheck-amd64-linux.so)
==6487==    by 0x4F2F77A: re_node_set_alloc (regex_internal.c:963)
==6487==    by 0x4F2F77A: calc_eclosure_iter (regcomp.c:1682)
==6487==    by 0x4F2FAF6: calc_eclosure_iter (regcomp.c:1719)
==6487==    by 0x4F2FAF6: calc_eclosure_iter (regcomp.c:1719)
==6487==    by 0x4F37713: calc_eclosure (regcomp.c:1659)
==6487==    by 0x4F37713: analyze (regcomp.c:1186)
==6487==    by 0x4F37713: re_compile_internal (regcomp.c:793)
==6487==    by 0x4F3D331: regcomp (regcomp.c:498)
==6487==    by 0x10A0E2: get_usr (ls.c:419)
==6487==    by 0x109D9A: get_stat_out (ls.c:352)
==6487==    by 0x109BB1: output_ent_stats (ls.c:312)
==6487==    by 0x109562: _ls (ls.c:141)
==6487==    by 0x109178: main (ls.c:31)
==6487== 
==6487== 132 bytes in 33 blocks are indirectly lost in loss record 12 of 76
==6487==    at 0x4C2FB0F: malloc (in /usr/lib/valgrind/vgpreload_memcheck-amd64-linux.so)
==6487==    by 0x4F376DE: re_node_set_init_1 (regex_internal.c:975)
==6487==    by 0x4F376DE: link_nfa_nodes (regcomp.c:1445)
==6487==    by 0x4F376DE: preorder (regcomp.c:1247)
==6487==    by 0x4F376DE: analyze (regcomp.c:1183)
==6487==    by 0x4F376DE: re_compile_internal (regcomp.c:793)
==6487==    by 0x4F3D331: regcomp (regcomp.c:498)
==6487==    by 0x10A0E2: get_usr (ls.c:419)
==6487==    by 0x109D9A: get_stat_out (ls.c:352)
==6487==    by 0x109BB1: output_ent_stats (ls.c:312)
==6487==    by 0x109562: _ls (ls.c:141)
==6487==    by 0x109178: main (ls.c:31)
==6487== 
==6487== 176 bytes in 11 blocks are indirectly lost in loss record 13 of 76
==6487==    at 0x4C2FB0F: malloc (in /usr/lib/valgrind/vgpreload_memcheck-amd64-linux.so)
==6487==    by 0x4F307D3: create_cd_newstate (regex_internal.c:1694)
==6487==    by 0x4F307D3: re_acquire_state_context (regex_internal.c:1534)
==6487==    by 0x4F37A65: create_initial_state (regcomp.c:1043)
==6487==    by 0x4F37A65: re_compile_internal (regcomp.c:804)
==6487==    by 0x4F3D331: regcomp (regcomp.c:498)
==6487==    by 0x10A0E2: get_usr (ls.c:419)
==6487==    by 0x109D9A: get_stat_out (ls.c:352)
==6487==    by 0x109BB1: output_ent_stats (ls.c:312)
==6487==    by 0x109562: _ls (ls.c:141)
==6487==    by 0x109178: main (ls.c:31)
==6487== 
==6487== 176 bytes in 11 blocks are indirectly lost in loss record 14 of 76
==6487==    at 0x4C2FA3F: malloc (in /usr/lib/valgrind/vgpreload_memcheck-amd64-linux.so)
==6487==    by 0x4C31D84: realloc (in /usr/lib/valgrind/vgpreload_memcheck-amd64-linux.so)
==6487==    by 0x4F2A3BD: register_state (regex_internal.c:1570)
==6487==    by 0x4F306DC: create_cd_newstate (regex_internal.c:1714)
==6487==    by 0x4F306DC: re_acquire_state_context (regex_internal.c:1534)
==6487==    by 0x4F37A65: create_initial_state (regcomp.c:1043)
==6487==    by 0x4F37A65: re_compile_internal (regcomp.c:804)
==6487==    by 0x4F3D331: regcomp (regcomp.c:498)
==6487==    by 0x10A0E2: get_usr (ls.c:419)
==6487==    by 0x109D9A: get_stat_out (ls.c:352)
==6487==    by 0x109BB1: output_ent_stats (ls.c:312)
==6487==    by 0x109562: _ls (ls.c:141)
==6487==    by 0x109178: main (ls.c:31)
==6487== 
==6487== 176 bytes in 11 blocks are indirectly lost in loss record 15 of 76
==6487==    at 0x4C2FB0F: malloc (in /usr/lib/valgrind/vgpreload_memcheck-amd64-linux.so)
==6487==    by 0x4F307D3: create_cd_newstate (regex_internal.c:1694)
==6487==    by 0x4F307D3: re_acquire_state_context (regex_internal.c:1534)
==6487==    by 0x4F37C7C: create_initial_state (regcomp.c:1049)
==6487==    by 0x4F37C7C: re_compile_internal (regcomp.c:804)
==6487==    by 0x4F3D331: regcomp (regcomp.c:498)
==6487==    by 0x10A0E2: get_usr (ls.c:419)
==6487==    by 0x109D9A: get_stat_out (ls.c:352)
==6487==    by 0x109BB1: output_ent_stats (ls.c:312)
==6487==    by 0x109562: _ls (ls.c:141)
==6487==    by 0x109178: main (ls.c:31)
==6487== 
==6487== 176 bytes in 11 blocks are indirectly lost in loss record 16 of 76
==6487==    at 0x4C2FA3F: malloc (in /usr/lib/valgrind/vgpreload_memcheck-amd64-linux.so)
==6487==    by 0x4C31D84: realloc (in /usr/lib/valgrind/vgpreload_memcheck-amd64-linux.so)
==6487==    by 0x4F2A3BD: register_state (regex_internal.c:1570)
==6487==    by 0x4F306DC: create_cd_newstate (regex_internal.c:1714)
==6487==    by 0x4F306DC: re_acquire_state_context (regex_internal.c:1534)
==6487==    by 0x4F37C7C: create_initial_state (regcomp.c:1049)
==6487==    by 0x4F37C7C: re_compile_internal (regcomp.c:804)
==6487==    by 0x4F3D331: regcomp (regcomp.c:498)
==6487==    by 0x10A0E2: get_usr (ls.c:419)
==6487==    by 0x109D9A: get_stat_out (ls.c:352)
==6487==    by 0x109BB1: output_ent_stats (ls.c:312)
==6487==    by 0x109562: _ls (ls.c:141)
==6487==    by 0x109178: main (ls.c:31)
==6487== 
==6487== 176 bytes in 11 blocks are indirectly lost in loss record 17 of 76
==6487==    at 0x4C2FB0F: malloc (in /usr/lib/valgrind/vgpreload_memcheck-amd64-linux.so)
==6487==    by 0x4F307D3: create_cd_newstate (regex_internal.c:1694)
==6487==    by 0x4F307D3: re_acquire_state_context (regex_internal.c:1534)
==6487==    by 0x4F37C93: create_initial_state (regcomp.c:1051)
==6487==    by 0x4F37C93: re_compile_internal (regcomp.c:804)
==6487==    by 0x4F3D331: regcomp (regcomp.c:498)
==6487==    by 0x10A0E2: get_usr (ls.c:419)
==6487==    by 0x109D9A: get_stat_out (ls.c:352)
==6487==    by 0x109BB1: output_ent_stats (ls.c:312)
==6487==    by 0x109562: _ls (ls.c:141)
==6487==    by 0x109178: main (ls.c:31)
==6487== 
==6487== 176 bytes in 11 blocks are indirectly lost in loss record 18 of 76
==6487==    at 0x4C2FA3F: malloc (in /usr/lib/valgrind/vgpreload_memcheck-amd64-linux.so)
==6487==    by 0x4C31D84: realloc (in /usr/lib/valgrind/vgpreload_memcheck-amd64-linux.so)
==6487==    by 0x4F2A3BD: register_state (regex_internal.c:1570)
==6487==    by 0x4F306DC: create_cd_newstate (regex_internal.c:1714)
==6487==    by 0x4F306DC: re_acquire_state_context (regex_internal.c:1534)
==6487==    by 0x4F37C93: create_initial_state (regcomp.c:1051)
==6487==    by 0x4F37C93: re_compile_internal (regcomp.c:804)
==6487==    by 0x4F3D331: regcomp (regcomp.c:498)
==6487==    by 0x10A0E2: get_usr (ls.c:419)
==6487==    by 0x109D9A: get_stat_out (ls.c:352)
==6487==    by 0x109BB1: output_ent_stats (ls.c:312)
==6487==    by 0x109562: _ls (ls.c:141)
==6487==    by 0x109178: main (ls.c:31)
==6487== 
==6487== 176 bytes in 11 blocks are indirectly lost in loss record 19 of 76
==6487==    at 0x4C2FB0F: malloc (in /usr/lib/valgrind/vgpreload_memcheck-amd64-linux.so)
==6487==    by 0x4F307D3: create_cd_newstate (regex_internal.c:1694)
==6487==    by 0x4F307D3: re_acquire_state_context (regex_internal.c:1534)
==6487==    by 0x4F37CAA: create_initial_state (regcomp.c:1053)
==6487==    by 0x4F37CAA: re_compile_internal (regcomp.c:804)
==6487==    by 0x4F3D331: regcomp (regcomp.c:498)
==6487==    by 0x10A0E2: get_usr (ls.c:419)
==6487==    by 0x109D9A: get_stat_out (ls.c:352)
==6487==    by 0x109BB1: output_ent_stats (ls.c:312)
==6487==    by 0x109562: _ls (ls.c:141)
==6487==    by 0x109178: main (ls.c:31)
==6487== 
==6487== 176 bytes in 11 blocks are indirectly lost in loss record 20 of 76
==6487==    at 0x4C2FA3F: malloc (in /usr/lib/valgrind/vgpreload_memcheck-amd64-linux.so)
==6487==    by 0x4C31D84: realloc (in /usr/lib/valgrind/vgpreload_memcheck-amd64-linux.so)
==6487==    by 0x4F2A3BD: register_state (regex_internal.c:1570)
==6487==    by 0x4F306DC: create_cd_newstate (regex_internal.c:1714)
==6487==    by 0x4F306DC: re_acquire_state_context (regex_internal.c:1534)
==6487==    by 0x4F37CAA: create_initial_state (regcomp.c:1053)
==6487==    by 0x4F37CAA: re_compile_internal (regcomp.c:804)
==6487==    by 0x4F3D331: regcomp (regcomp.c:498)
==6487==    by 0x10A0E2: get_usr (ls.c:419)
==6487==    by 0x109D9A: get_stat_out (ls.c:352)
==6487==    by 0x109BB1: output_ent_stats (ls.c:312)
==6487==    by 0x109562: _ls (ls.c:141)
==6487==    by 0x109178: main (ls.c:31)
==6487== 
==6487== 176 bytes in 11 blocks are indirectly lost in loss record 21 of 76
==6487==    at 0x4C2FA3F: malloc (in /usr/lib/valgrind/vgpreload_memcheck-amd64-linux.so)
==6487==    by 0x4C31D84: realloc (in /usr/lib/valgrind/vgpreload_memcheck-amd64-linux.so)
==6487==    by 0x4F2A3BD: register_state (regex_internal.c:1570)
==6487==    by 0x4F2FDCC: create_ci_newstate (regex_internal.c:1638)
==6487==    by 0x4F2FDCC: re_acquire_state (regex_internal.c:1491)
==6487==    by 0x4F39BBA: add_epsilon_src_nodes (regexec.c:1775)
==6487==    by 0x4F39BBA: update_cur_sifted_state (regexec.c:1739)
==6487==    by 0x4F3A760: sift_states_backward (regexec.c:1567)
==6487==    by 0x4F3C448: prune_impossible_nodes (regexec.c:971)
==6487==    by 0x4F3C448: re_search_internal (regexec.c:811)
==6487==    by 0x4F3D729: regexec@@GLIBC_2.3.4 (regexec.c:220)
==6487==    by 0x10A1AE: get_usr (ls.c:430)
==6487==    by 0x109D9A: get_stat_out (ls.c:352)
==6487==    by 0x109BB1: output_ent_stats (ls.c:312)
==6487==    by 0x109562: _ls (ls.c:141)
==6487== 
==6487== 176 bytes in 11 blocks are indirectly lost in loss record 22 of 76
==6487==    at 0x4C31D2F: realloc (in /usr/lib/valgrind/vgpreload_memcheck-amd64-linux.so)
==6487==    by 0x4F3A224: re_node_set_merge (regex_internal.c:1194)
==6487==    by 0x4F3A224: add_epsilon_src_nodes (regexec.c:1786)
==6487==    by 0x4F3A224: update_cur_sifted_state (regexec.c:1739)
==6487==    by 0x4F3A760: sift_states_backward (regexec.c:1567)
==6487==    by 0x4F3C448: prune_impossible_nodes (regexec.c:971)
==6487==    by 0x4F3C448: re_search_internal (regexec.c:811)
==6487==    by 0x4F3D729: regexec@@GLIBC_2.3.4 (regexec.c:220)
==6487==    by 0x10A1AE: get_usr (ls.c:430)
==6487==    by 0x109D9A: get_stat_out (ls.c:352)
==6487==    by 0x109BB1: output_ent_stats (ls.c:312)
==6487==    by 0x109562: _ls (ls.c:141)
==6487==    by 0x109178: main (ls.c:31)
==6487== 
==6487== 176 bytes in 22 blocks are indirectly lost in loss record 23 of 76
==6487==    at 0x4C2FB0F: malloc (in /usr/lib/valgrind/vgpreload_memcheck-amd64-linux.so)
==6487==    by 0x4F375E6: re_node_set_init_2 (regex_internal.c:990)
==6487==    by 0x4F375E6: link_nfa_nodes (regcomp.c:1438)
==6487==    by 0x4F375E6: preorder (regcomp.c:1247)
==6487==    by 0x4F375E6: analyze (regcomp.c:1183)
==6487==    by 0x4F375E6: re_compile_internal (regcomp.c:793)
==6487==    by 0x4F3D331: regcomp (regcomp.c:498)
==6487==    by 0x10A0E2: get_usr (ls.c:419)
==6487==    by 0x109D9A: get_stat_out (ls.c:352)
==6487==    by 0x109BB1: output_ent_stats (ls.c:312)
==6487==    by 0x109562: _ls (ls.c:141)
==6487==    by 0x109178: main (ls.c:31)
==6487== 
==6487== 176 bytes in 33 blocks are indirectly lost in loss record 24 of 76
==6487==    at 0x4C2FB0F: malloc (in /usr/lib/valgrind/vgpreload_memcheck-amd64-linux.so)
==6487==    by 0x4F2F77A: re_node_set_alloc (regex_internal.c:963)
==6487==    by 0x4F2F77A: calc_eclosure_iter (regcomp.c:1682)
==6487==    by 0x4F2FAF6: calc_eclosure_iter (regcomp.c:1719)
==6487==    by 0x4F2FAF6: calc_eclosure_iter (regcomp.c:1719)
==6487==    by 0x4F2FAF6: calc_eclosure_iter (regcomp.c:1719)
==6487==    by 0x4F37713: calc_eclosure (regcomp.c:1659)
==6487==    by 0x4F37713: analyze (regcomp.c:1186)
==6487==    by 0x4F37713: re_compile_internal (regcomp.c:793)
==6487==    by 0x4F3D331: regcomp (regcomp.c:498)
==6487==    by 0x10A0E2: get_usr (ls.c:419)
==6487==    by 0x109D9A: get_stat_out (ls.c:352)
==6487==    by 0x109BB1: output_ent_stats (ls.c:312)
==6487==    by 0x109562: _ls (ls.c:141)
==6487==    by 0x109178: main (ls.c:31)
==6487== 
==6487== 264 bytes in 11 blocks are indirectly lost in loss record 25 of 76
==6487==    at 0x4C2FB0F: malloc (in /usr/lib/valgrind/vgpreload_memcheck-amd64-linux.so)
==6487==    by 0x4F30512: re_node_set_init_copy (regex_internal.c:1023)
==6487==    by 0x4F30512: create_cd_newstate (regex_internal.c:1662)
==6487==    by 0x4F30512: re_acquire_state_context (regex_internal.c:1534)
==6487==    by 0x4F37A65: create_initial_state (regcomp.c:1043)
==6487==    by 0x4F37A65: re_compile_internal (regcomp.c:804)
==6487==    by 0x4F3D331: regcomp (regcomp.c:498)
==6487==    by 0x10A0E2: get_usr (ls.c:419)
==6487==    by 0x109D9A: get_stat_out (ls.c:352)
==6487==    by 0x109BB1: output_ent_stats (ls.c:312)
==6487==    by 0x109562: _ls (ls.c:141)
==6487==    by 0x109178: main (ls.c:31)
==6487== 
==6487== 264 bytes in 11 blocks are indirectly lost in loss record 26 of 76
==6487==    at 0x4C2FB0F: malloc (in /usr/lib/valgrind/vgpreload_memcheck-amd64-linux.so)
==6487==    by 0x4F30814: re_node_set_init_copy (regex_internal.c:1023)
==6487==    by 0x4F30814: create_cd_newstate (regex_internal.c:1700)
==6487==    by 0x4F30814: re_acquire_state_context (regex_internal.c:1534)
==6487==    by 0x4F37A65: create_initial_state (regcomp.c:1043)
==6487==    by 0x4F37A65: re_compile_internal (regcomp.c:804)
==6487==    by 0x4F3D331: regcomp (regcomp.c:498)
==6487==    by 0x10A0E2: get_usr (ls.c:419)
==6487==    by 0x109D9A: get_stat_out (ls.c:352)
==6487==    by 0x109BB1: output_ent_stats (ls.c:312)
==6487==    by 0x109562: _ls (ls.c:141)
==6487==    by 0x109178: main (ls.c:31)
==6487== 
==6487== 264 bytes in 11 blocks are indirectly lost in loss record 27 of 76
==6487==    at 0x4C2FB0F: malloc (in /usr/lib/valgrind/vgpreload_memcheck-amd64-linux.so)
==6487==    by 0x4F30512: re_node_set_init_copy (regex_internal.c:1023)
==6487==    by 0x4F30512: create_cd_newstate (regex_internal.c:1662)
==6487==    by 0x4F30512: re_acquire_state_context (regex_internal.c:1534)
==6487==    by 0x4F37C7C: create_initial_state (regcomp.c:1049)
==6487==    by 0x4F37C7C: re_compile_internal (regcomp.c:804)
==6487==    by 0x4F3D331: regcomp (regcomp.c:498)
==6487==    by 0x10A0E2: get_usr (ls.c:419)
==6487==    by 0x109D9A: get_stat_out (ls.c:352)
==6487==    by 0x109BB1: output_ent_stats (ls.c:312)
==6487==    by 0x109562: _ls (ls.c:141)
==6487==    by 0x109178: main (ls.c:31)
==6487== 
==6487== 264 bytes in 11 blocks are indirectly lost in loss record 28 of 76
==6487==    at 0x4C2FB0F: malloc (in /usr/lib/valgrind/vgpreload_memcheck-amd64-linux.so)
==6487==    by 0x4F30814: re_node_set_init_copy (regex_internal.c:1023)
==6487==    by 0x4F30814: create_cd_newstate (regex_internal.c:1700)
==6487==    by 0x4F30814: re_acquire_state_context (regex_internal.c:1534)
==6487==    by 0x4F37C7C: create_initial_state (regcomp.c:1049)
==6487==    by 0x4F37C7C: re_compile_internal (regcomp.c:804)
==6487==    by 0x4F3D331: regcomp (regcomp.c:498)
==6487==    by 0x10A0E2: get_usr (ls.c:419)
==6487==    by 0x109D9A: get_stat_out (ls.c:352)
==6487==    by 0x109BB1: output_ent_stats (ls.c:312)
==6487==    by 0x109562: _ls (ls.c:141)
==6487==    by 0x109178: main (ls.c:31)
==6487== 
==6487== 264 bytes in 11 blocks are indirectly lost in loss record 29 of 76
==6487==    at 0x4C2FB0F: malloc (in /usr/lib/valgrind/vgpreload_memcheck-amd64-linux.so)
==6487==    by 0x4F30512: re_node_set_init_copy (regex_internal.c:1023)
==6487==    by 0x4F30512: create_cd_newstate (regex_internal.c:1662)
==6487==    by 0x4F30512: re_acquire_state_context (regex_internal.c:1534)
==6487==    by 0x4F37C93: create_initial_state (regcomp.c:1051)
==6487==    by 0x4F37C93: re_compile_internal (regcomp.c:804)
==6487==    by 0x4F3D331: regcomp (regcomp.c:498)
==6487==    by 0x10A0E2: get_usr (ls.c:419)
==6487==    by 0x109D9A: get_stat_out (ls.c:352)
==6487==    by 0x109BB1: output_ent_stats (ls.c:312)
==6487==    by 0x109562: _ls (ls.c:141)
==6487==    by 0x109178: main (ls.c:31)
==6487== 
==6487== 264 bytes in 11 blocks are indirectly lost in loss record 30 of 76
==6487==    at 0x4C2FB0F: malloc (in /usr/lib/valgrind/vgpreload_memcheck-amd64-linux.so)
==6487==    by 0x4F30814: re_node_set_init_copy (regex_internal.c:1023)
==6487==    by 0x4F30814: create_cd_newstate (regex_internal.c:1700)
==6487==    by 0x4F30814: re_acquire_state_context (regex_internal.c:1534)
==6487==    by 0x4F37C93: create_initial_state (regcomp.c:1051)
==6487==    by 0x4F37C93: re_compile_internal (regcomp.c:804)
==6487==    by 0x4F3D331: regcomp (regcomp.c:498)
==6487==    by 0x10A0E2: get_usr (ls.c:419)
==6487==    by 0x109D9A: get_stat_out (ls.c:352)
==6487==    by 0x109BB1: output_ent_stats (ls.c:312)
==6487==    by 0x109562: _ls (ls.c:141)
==6487==    by 0x109178: main (ls.c:31)
==6487== 
==6487== 264 bytes in 11 blocks are indirectly lost in loss record 31 of 76
==6487==    at 0x4C2FB0F: malloc (in /usr/lib/valgrind/vgpreload_memcheck-amd64-linux.so)
==6487==    by 0x4F2A2C2: re_node_set_alloc (regex_internal.c:963)
==6487==    by 0x4F2A2C2: register_state (regex_internal.c:1555)
==6487==    by 0x4F306DC: create_cd_newstate (regex_internal.c:1714)
==6487==    by 0x4F306DC: re_acquire_state_context (regex_internal.c:1534)
==6487==    by 0x4F37C93: create_initial_state (regcomp.c:1051)
==6487==    by 0x4F37C93: re_compile_internal (regcomp.c:804)
==6487==    by 0x4F3D331: regcomp (regcomp.c:498)
==6487==    by 0x10A0E2: get_usr (ls.c:419)
==6487==    by 0x109D9A: get_stat_out (ls.c:352)
==6487==    by 0x109BB1: output_ent_stats (ls.c:312)
==6487==    by 0x109562: _ls (ls.c:141)
==6487==    by 0x109178: main (ls.c:31)
==6487== 
==6487== 264 bytes in 11 blocks are indirectly lost in loss record 32 of 76
==6487==    at 0x4C2FB0F: malloc (in /usr/lib/valgrind/vgpreload_memcheck-amd64-linux.so)
==6487==    by 0x4F30512: re_node_set_init_copy (regex_internal.c:1023)
==6487==    by 0x4F30512: create_cd_newstate (regex_internal.c:1662)
==6487==    by 0x4F30512: re_acquire_state_context (regex_internal.c:1534)
==6487==    by 0x4F37CAA: create_initial_state (regcomp.c:1053)
==6487==    by 0x4F37CAA: re_compile_internal (regcomp.c:804)
==6487==    by 0x4F3D331: regcomp (regcomp.c:498)
==6487==    by 0x10A0E2: get_usr (ls.c:419)
==6487==    by 0x109D9A: get_stat_out (ls.c:352)
==6487==    by 0x109BB1: output_ent_stats (ls.c:312)
==6487==    by 0x109562: _ls (ls.c:141)
==6487==    by 0x109178: main (ls.c:31)
==6487== 
==6487== 264 bytes in 11 blocks are indirectly lost in loss record 33 of 76
==6487==    at 0x4C2FB0F: malloc (in /usr/lib/valgrind/vgpreload_memcheck-amd64-linux.so)
==6487==    by 0x4F30814: re_node_set_init_copy (regex_internal.c:1023)
==6487==    by 0x4F30814: create_cd_newstate (regex_internal.c:1700)
==6487==    by 0x4F30814: re_acquire_state_context (regex_internal.c:1534)
==6487==    by 0x4F37CAA: create_initial_state (regcomp.c:1053)
==6487==    by 0x4F37CAA: re_compile_internal (regcomp.c:804)
==6487==    by 0x4F3D331: regcomp (regcomp.c:498)
==6487==    by 0x10A0E2: get_usr (ls.c:419)
==6487==    by 0x109D9A: get_stat_out (ls.c:352)
==6487==    by 0x109BB1: output_ent_stats (ls.c:312)
==6487==    by 0x109562: _ls (ls.c:141)
==6487==    by 0x109178: main (ls.c:31)
==6487== 
==6487== 264 bytes in 11 blocks are indirectly lost in loss record 34 of 76
==6487==    at 0x4C2FB0F: malloc (in /usr/lib/valgrind/vgpreload_memcheck-amd64-linux.so)
==6487==    by 0x4F2A2C2: re_node_set_alloc (regex_internal.c:963)
==6487==    by 0x4F2A2C2: register_state (regex_internal.c:1555)
==6487==    by 0x4F306DC: create_cd_newstate (regex_internal.c:1714)
==6487==    by 0x4F306DC: re_acquire_state_context (regex_internal.c:1534)
==6487==    by 0x4F37CAA: create_initial_state (regcomp.c:1053)
==6487==    by 0x4F37CAA: re_compile_internal (regcomp.c:804)
==6487==    by 0x4F3D331: regcomp (regcomp.c:498)
==6487==    by 0x10A0E2: get_usr (ls.c:419)
==6487==    by 0x109D9A: get_stat_out (ls.c:352)
==6487==    by 0x109BB1: output_ent_stats (ls.c:312)
==6487==    by 0x109562: _ls (ls.c:141)
==6487==    by 0x109178: main (ls.c:31)
==6487== 
==6487== 352 bytes in 11 blocks are indirectly lost in loss record 35 of 76
==6487==    at 0x4C31B25: calloc (in /usr/lib/valgrind/vgpreload_memcheck-amd64-linux.so)
==6487==    by 0x4F34F83: parse_bracket_exp (regcomp.c:3049)
==6487==    by 0x4F34F83: parse_expression (regcomp.c:2262)
==6487==    by 0x4F364CB: parse_branch (regcomp.c:2183)
==6487==    by 0x4F3668B: parse_reg_exp (regcomp.c:2138)
==6487==    by 0x4F34144: parse_sub_exp (regcomp.c:2461)
==6487==    by 0x4F34144: parse_expression (regcomp.c:2257)
==6487==    by 0x4F36519: parse_branch (regcomp.c:2190)
==6487==    by 0x4F3668B: parse_reg_exp (regcomp.c:2138)
==6487==    by 0x4F36D7C: parse (regcomp.c:2107)
==6487==    by 0x4F36D7C: re_compile_internal (regcomp.c:788)
==6487==    by 0x4F3D331: regcomp (regcomp.c:498)
==6487==    by 0x10A0E2: get_usr (ls.c:419)
==6487==    by 0x109D9A: get_stat_out (ls.c:352)
==6487==    by 0x109BB1: output_ent_stats (ls.c:312)
==6487== 
==6487== 352 bytes in 11 blocks are indirectly lost in loss record 36 of 76
==6487==    at 0x4C31B25: calloc (in /usr/lib/valgrind/vgpreload_memcheck-amd64-linux.so)
==6487==    by 0x4F34F83: parse_bracket_exp (regcomp.c:3049)
==6487==    by 0x4F34F83: parse_expression (regcomp.c:2262)
==6487==    by 0x4F36519: parse_branch (regcomp.c:2190)
==6487==    by 0x4F3668B: parse_reg_exp (regcomp.c:2138)
==6487==    by 0x4F36D7C: parse (regcomp.c:2107)
==6487==    by 0x4F36D7C: re_compile_internal (regcomp.c:788)
==6487==    by 0x4F3D331: regcomp (regcomp.c:498)
==6487==    by 0x10A0E2: get_usr (ls.c:419)
==6487==    by 0x109D9A: get_stat_out (ls.c:352)
==6487==    by 0x109BB1: output_ent_stats (ls.c:312)
==6487==    by 0x109562: _ls (ls.c:141)
==6487==    by 0x109178: main (ls.c:31)
==6487== 
==6487== 352 bytes in 22 blocks are indirectly lost in loss record 37 of 76
==6487==    at 0x4C2FA3F: malloc (in /usr/lib/valgrind/vgpreload_memcheck-amd64-linux.so)
==6487==    by 0x4C31D84: realloc (in /usr/lib/valgrind/vgpreload_memcheck-amd64-linux.so)
==6487==    by 0x4F2A3BD: register_state (regex_internal.c:1570)
==6487==    by 0x4F2FDCC: create_ci_newstate (regex_internal.c:1638)
==6487==    by 0x4F2FDCC: re_acquire_state (regex_internal.c:1491)
==6487==    by 0x4F39D3E: update_cur_sifted_state (regexec.c:1753)
==6487==    by 0x4F3A99E: sift_states_backward (regexec.c:1597)
==6487==    by 0x4F3C448: prune_impossible_nodes (regexec.c:971)
==6487==    by 0x4F3C448: re_search_internal (regexec.c:811)
==6487==    by 0x4F3D729: regexec@@GLIBC_2.3.4 (regexec.c:220)
==6487==    by 0x10A1AE: get_usr (ls.c:430)
==6487==    by 0x109D9A: get_stat_out (ls.c:352)
==6487==    by 0x109BB1: output_ent_stats (ls.c:312)
==6487==    by 0x109562: _ls (ls.c:141)
==6487== 
==6487== 352 bytes in 66 blocks are indirectly lost in loss record 38 of 76
==6487==    at 0x4C2FB0F: malloc (in /usr/lib/valgrind/vgpreload_memcheck-amd64-linux.so)
==6487==    by 0x4F2F77A: re_node_set_alloc (regex_internal.c:963)
==6487==    by 0x4F2F77A: calc_eclosure_iter (regcomp.c:1682)
==6487==    by 0x4F37713: calc_eclosure (regcomp.c:1659)
==6487==    by 0x4F37713: analyze (regcomp.c:1186)
==6487==    by 0x4F37713: re_compile_internal (regcomp.c:793)
==6487==    by 0x4F3D331: regcomp (regcomp.c:498)
==6487==    by 0x10A0E2: get_usr (ls.c:419)
==6487==    by 0x109D9A: get_stat_out (ls.c:352)
==6487==    by 0x109BB1: output_ent_stats (ls.c:312)
==6487==    by 0x109562: _ls (ls.c:141)
==6487==    by 0x109178: main (ls.c:31)
==6487== 
==6487== 352 bytes in 88 blocks are indirectly lost in loss record 39 of 76
==6487==    at 0x4C2FB0F: malloc (in /usr/lib/valgrind/vgpreload_memcheck-amd64-linux.so)
==6487==    by 0x4F2FCE9: re_node_set_init_copy (regex_internal.c:1023)
==6487==    by 0x4F2FCE9: create_ci_newstate (regex_internal.c:1612)
==6487==    by 0x4F2FCE9: re_acquire_state (regex_internal.c:1491)
==6487==    by 0x4F39BBA: add_epsilon_src_nodes (regexec.c:1775)
==6487==    by 0x4F39BBA: update_cur_sifted_state (regexec.c:1739)
==6487==    by 0x4F3A99E: sift_states_backward (regexec.c:1597)
==6487==    by 0x4F3C448: prune_impossible_nodes (regexec.c:971)
==6487==    by 0x4F3C448: re_search_internal (regexec.c:811)
==6487==    by 0x4F3D729: regexec@@GLIBC_2.3.4 (regexec.c:220)
==6487==    by 0x10A1AE: get_usr (ls.c:430)
==6487==    by 0x109D9A: get_stat_out (ls.c:352)
==6487==    by 0x109BB1: output_ent_stats (ls.c:312)
==6487==    by 0x109562: _ls (ls.c:141)
==6487==    by 0x109178: main (ls.c:31)
==6487== 
==6487== 352 bytes in 88 blocks are indirectly lost in loss record 40 of 76
==6487==    at 0x4C2FB0F: malloc (in /usr/lib/valgrind/vgpreload_memcheck-amd64-linux.so)
==6487==    by 0x4F2A2C2: re_node_set_alloc (regex_internal.c:963)
==6487==    by 0x4F2A2C2: register_state (regex_internal.c:1555)
==6487==    by 0x4F2FDCC: create_ci_newstate (regex_internal.c:1638)
==6487==    by 0x4F2FDCC: re_acquire_state (regex_internal.c:1491)
==6487==    by 0x4F39BBA: add_epsilon_src_nodes (regexec.c:1775)
==6487==    by 0x4F39BBA: update_cur_sifted_state (regexec.c:1739)
==6487==    by 0x4F3A99E: sift_states_backward (regexec.c:1597)
==6487==    by 0x4F3C448: prune_impossible_nodes (regexec.c:971)
==6487==    by 0x4F3C448: re_search_internal (regexec.c:811)
==6487==    by 0x4F3D729: regexec@@GLIBC_2.3.4 (regexec.c:220)
==6487==    by 0x10A1AE: get_usr (ls.c:430)
==6487==    by 0x109D9A: get_stat_out (ls.c:352)
==6487==    by 0x109BB1: output_ent_stats (ls.c:312)
==6487==    by 0x109562: _ls (ls.c:141)
==6487==    by 0x109178: main (ls.c:31)
==6487== 
==6487== 440 bytes in 11 blocks are indirectly lost in loss record 41 of 76
==6487==    at 0x4C31D2F: realloc (in /usr/lib/valgrind/vgpreload_memcheck-amd64-linux.so)
==6487==    by 0x4F2FA8A: re_node_set_merge (regex_internal.c:1194)
==6487==    by 0x4F2FA8A: calc_eclosure_iter (regcomp.c:1726)
==6487==    by 0x4F2FAF6: calc_eclosure_iter (regcomp.c:1719)
==6487==    by 0x4F2FAF6: calc_eclosure_iter (regcomp.c:1719)
==6487==    by 0x4F37713: calc_eclosure (regcomp.c:1659)
==6487==    by 0x4F37713: analyze (regcomp.c:1186)
==6487==    by 0x4F37713: re_compile_internal (regcomp.c:793)
==6487==    by 0x4F3D331: regcomp (regcomp.c:498)
==6487==    by 0x10A0E2: get_usr (ls.c:419)
==6487==    by 0x109D9A: get_stat_out (ls.c:352)
==6487==    by 0x109BB1: output_ent_stats (ls.c:312)
==6487==    by 0x109562: _ls (ls.c:141)
==6487==    by 0x109178: main (ls.c:31)
==6487== 
==6487== 552 bytes in 1 blocks are still reachable in loss record 42 of 76
==6487==    at 0x4C2FB0F: malloc (in /usr/lib/valgrind/vgpreload_memcheck-amd64-linux.so)
==6487==    by 0x4EBAE49: __fopen_internal (iofopen.c:65)
==6487==    by 0x4EBAE49: fopen@@GLIBC_2.2.5 (iofopen.c:89)
==6487==    by 0x109AB3: output_ent_stats (ls.c:293)
==6487==    by 0x109562: _ls (ls.c:141)
==6487==    by 0x109178: main (ls.c:31)
==6487== 
==6487== 552 bytes in 1 blocks are still reachable in loss record 43 of 76
==6487==    at 0x4C2FB0F: malloc (in /usr/lib/valgrind/vgpreload_memcheck-amd64-linux.so)
==6487==    by 0x4EBAE49: __fopen_internal (iofopen.c:65)
==6487==    by 0x4EBAE49: fopen@@GLIBC_2.2.5 (iofopen.c:89)
==6487==    by 0x109B13: output_ent_stats (ls.c:302)
==6487==    by 0x109562: _ls (ls.c:141)
==6487==    by 0x109178: main (ls.c:31)
==6487== 
==6487== 572 bytes in 55 blocks are indirectly lost in loss record 44 of 76
==6487==    at 0x4C2FB0F: malloc (in /usr/lib/valgrind/vgpreload_memcheck-amd64-linux.so)
==6487==    by 0x4F2FCE9: re_node_set_init_copy (regex_internal.c:1023)
==6487==    by 0x4F2FCE9: create_ci_newstate (regex_internal.c:1612)
==6487==    by 0x4F2FCE9: re_acquire_state (regex_internal.c:1491)
==6487==    by 0x4F39D3E: update_cur_sifted_state (regexec.c:1753)
==6487==    by 0x4F3A99E: sift_states_backward (regexec.c:1597)
==6487==    by 0x4F3C448: prune_impossible_nodes (regexec.c:971)
==6487==    by 0x4F3C448: re_search_internal (regexec.c:811)
==6487==    by 0x4F3D729: regexec@@GLIBC_2.3.4 (regexec.c:220)
==6487==    by 0x10A1AE: get_usr (ls.c:430)
==6487==    by 0x109D9A: get_stat_out (ls.c:352)
==6487==    by 0x109BB1: output_ent_stats (ls.c:312)
==6487==    by 0x109562: _ls (ls.c:141)
==6487==    by 0x109178: main (ls.c:31)
==6487== 
==6487== 572 bytes in 55 blocks are indirectly lost in loss record 45 of 76
==6487==    at 0x4C2FB0F: malloc (in /usr/lib/valgrind/vgpreload_memcheck-amd64-linux.so)
==6487==    by 0x4F2A2C2: re_node_set_alloc (regex_internal.c:963)
==6487==    by 0x4F2A2C2: register_state (regex_internal.c:1555)
==6487==    by 0x4F2FDCC: create_ci_newstate (regex_internal.c:1638)
==6487==    by 0x4F2FDCC: re_acquire_state (regex_internal.c:1491)
==6487==    by 0x4F39D3E: update_cur_sifted_state (regexec.c:1753)
==6487==    by 0x4F3A99E: sift_states_backward (regexec.c:1597)
==6487==    by 0x4F3C448: prune_impossible_nodes (regexec.c:971)
==6487==    by 0x4F3C448: re_search_internal (regexec.c:811)
==6487==    by 0x4F3D729: regexec@@GLIBC_2.3.4 (regexec.c:220)
==6487==    by 0x10A1AE: get_usr (ls.c:430)
==6487==    by 0x109D9A: get_stat_out (ls.c:352)
==6487==    by 0x109BB1: output_ent_stats (ls.c:312)
==6487==    by 0x109562: _ls (ls.c:141)
==6487==    by 0x109178: main (ls.c:31)
==6487== 
==6487== 800 bytes in 1 blocks are still reachable in loss record 46 of 76
==6487==    at 0x4C2FB0F: malloc (in /usr/lib/valgrind/vgpreload_memcheck-amd64-linux.so)
==6487==    by 0x109A6B: output_ent_stats (ls.c:287)
==6487==    by 0x109562: _ls (ls.c:141)
==6487==    by 0x109178: main (ls.c:31)
==6487== 
==6487== 832 bytes in 11 blocks are still reachable in loss record 47 of 76
==6487==    at 0x4C2FB0F: malloc (in /usr/lib/valgrind/vgpreload_memcheck-amd64-linux.so)
==6487==    by 0x10A447: make_key (f_list.c:29)
==6487==    by 0x10A7A5: f_list_add_elem (f_list.c:111)
==6487==    by 0x10995D: get_ent_stats (ls.c:257)
==6487==    by 0x109472: _ls (ls.c:107)
==6487==    by 0x109178: main (ls.c:31)
==6487== 
==6487== 880 bytes in 55 blocks are indirectly lost in loss record 48 of 76
==6487==    at 0x4C2FA3F: malloc (in /usr/lib/valgrind/vgpreload_memcheck-amd64-linux.so)
==6487==    by 0x4C31D84: realloc (in /usr/lib/valgrind/vgpreload_memcheck-amd64-linux.so)
==6487==    by 0x4F2A3BD: register_state (regex_internal.c:1570)
==6487==    by 0x4F306DC: create_cd_newstate (regex_internal.c:1714)
==6487==    by 0x4F306DC: re_acquire_state_context (regex_internal.c:1534)
==6487==    by 0x4F31259: build_trtable (regexec.c:3361)
==6487==    by 0x4F3C0B7: transit_state (regexec.c:2251)
==6487==    by 0x4F3C0B7: check_matching (regexec.c:1118)
==6487==    by 0x4F3C0B7: re_search_internal (regexec.c:790)
==6487==    by 0x4F3D729: regexec@@GLIBC_2.3.4 (regexec.c:220)
==6487==    by 0x10A1AE: get_usr (ls.c:430)
==6487==    by 0x109D9A: get_stat_out (ls.c:352)
==6487==    by 0x109BB1: output_ent_stats (ls.c:312)
==6487==    by 0x109562: _ls (ls.c:141)
==6487==    by 0x109178: main (ls.c:31)
==6487== 
==6487== 968 bytes in 11 blocks are indirectly lost in loss record 49 of 76
==6487==    at 0x4C31B25: calloc (in /usr/lib/valgrind/vgpreload_memcheck-amd64-linux.so)
==6487==    by 0x4F304CA: create_cd_newstate (regex_internal.c:1659)
==6487==    by 0x4F304CA: re_acquire_state_context (regex_internal.c:1534)
==6487==    by 0x4F37A65: create_initial_state (regcomp.c:1043)
==6487==    by 0x4F37A65: re_compile_internal (regcomp.c:804)
==6487==    by 0x4F3D331: regcomp (regcomp.c:498)
==6487==    by 0x10A0E2: get_usr (ls.c:419)
==6487==    by 0x109D9A: get_stat_out (ls.c:352)
==6487==    by 0x109BB1: output_ent_stats (ls.c:312)
==6487==    by 0x109562: _ls (ls.c:141)
==6487==    by 0x109178: main (ls.c:31)
==6487== 
==6487== 968 bytes in 11 blocks are indirectly lost in loss record 50 of 76
==6487==    at 0x4C31B25: calloc (in /usr/lib/valgrind/vgpreload_memcheck-amd64-linux.so)
==6487==    by 0x4F304CA: create_cd_newstate (regex_internal.c:1659)
==6487==    by 0x4F304CA: re_acquire_state_context (regex_internal.c:1534)
==6487==    by 0x4F37C7C: create_initial_state (regcomp.c:1049)
==6487==    by 0x4F37C7C: re_compile_internal (regcomp.c:804)
==6487==    by 0x4F3D331: regcomp (regcomp.c:498)
==6487==    by 0x10A0E2: get_usr (ls.c:419)
==6487==    by 0x109D9A: get_stat_out (ls.c:352)
==6487==    by 0x109BB1: output_ent_stats (ls.c:312)
==6487==    by 0x109562: _ls (ls.c:141)
==6487==    by 0x109178: main (ls.c:31)
==6487== 
==6487== 968 bytes in 11 blocks are indirectly lost in loss record 51 of 76
==6487==    at 0x4C31B25: calloc (in /usr/lib/valgrind/vgpreload_memcheck-amd64-linux.so)
==6487==    by 0x4F304CA: create_cd_newstate (regex_internal.c:1659)
==6487==    by 0x4F304CA: re_acquire_state_context (regex_internal.c:1534)
==6487==    by 0x4F37C93: create_initial_state (regcomp.c:1051)
==6487==    by 0x4F37C93: re_compile_internal (regcomp.c:804)
==6487==    by 0x4F3D331: regcomp (regcomp.c:498)
==6487==    by 0x10A0E2: get_usr (ls.c:419)
==6487==    by 0x109D9A: get_stat_out (ls.c:352)
==6487==    by 0x109BB1: output_ent_stats (ls.c:312)
==6487==    by 0x109562: _ls (ls.c:141)
==6487==    by 0x109178: main (ls.c:31)
==6487== 
==6487== 968 bytes in 11 blocks are indirectly lost in loss record 52 of 76
==6487==    at 0x4C31B25: calloc (in /usr/lib/valgrind/vgpreload_memcheck-amd64-linux.so)
==6487==    by 0x4F304CA: create_cd_newstate (regex_internal.c:1659)
==6487==    by 0x4F304CA: re_acquire_state_context (regex_internal.c:1534)
==6487==    by 0x4F37CAA: create_initial_state (regcomp.c:1053)
==6487==    by 0x4F37CAA: re_compile_internal (regcomp.c:804)
==6487==    by 0x4F3D331: regcomp (regcomp.c:498)
==6487==    by 0x10A0E2: get_usr (ls.c:419)
==6487==    by 0x109D9A: get_stat_out (ls.c:352)
==6487==    by 0x109BB1: output_ent_stats (ls.c:312)
==6487==    by 0x109562: _ls (ls.c:141)
==6487==    by 0x109178: main (ls.c:31)
==6487== 
==6487== 968 bytes in 11 blocks are indirectly lost in loss record 53 of 76
==6487==    at 0x4C31B25: calloc (in /usr/lib/valgrind/vgpreload_memcheck-amd64-linux.so)
==6487==    by 0x4F2FCB0: create_ci_newstate (regex_internal.c:1609)
==6487==    by 0x4F2FCB0: re_acquire_state (regex_internal.c:1491)
==6487==    by 0x4F39BBA: add_epsilon_src_nodes (regexec.c:1775)
==6487==    by 0x4F39BBA: update_cur_sifted_state (regexec.c:1739)
==6487==    by 0x4F3A760: sift_states_backward (regexec.c:1567)
==6487==    by 0x4F3C448: prune_impossible_nodes (regexec.c:971)
==6487==    by 0x4F3C448: re_search_internal (regexec.c:811)
==6487==    by 0x4F3D729: regexec@@GLIBC_2.3.4 (regexec.c:220)
==6487==    by 0x10A1AE: get_usr (ls.c:430)
==6487==    by 0x109D9A: get_stat_out (ls.c:352)
==6487==    by 0x109BB1: output_ent_stats (ls.c:312)
==6487==    by 0x109562: _ls (ls.c:141)
==6487==    by 0x109178: main (ls.c:31)
==6487== 
==6487== 968 bytes in 22 blocks are indirectly lost in loss record 54 of 76
==6487==    at 0x4C31D2F: realloc (in /usr/lib/valgrind/vgpreload_memcheck-amd64-linux.so)
==6487==    by 0x4F2FA8A: re_node_set_merge (regex_internal.c:1194)
==6487==    by 0x4F2FA8A: calc_eclosure_iter (regcomp.c:1726)
==6487==    by 0x4F2FAF6: calc_eclosure_iter (regcomp.c:1719)
==6487==    by 0x4F37713: calc_eclosure (regcomp.c:1659)
==6487==    by 0x4F37713: analyze (regcomp.c:1186)
==6487==    by 0x4F37713: re_compile_internal (regcomp.c:793)
==6487==    by 0x4F3D331: regcomp (regcomp.c:498)
==6487==    by 0x10A0E2: get_usr (ls.c:419)
==6487==    by 0x109D9A: get_stat_out (ls.c:352)
==6487==    by 0x109BB1: output_ent_stats (ls.c:312)
==6487==    by 0x109562: _ls (ls.c:141)
==6487==    by 0x109178: main (ls.c:31)
==6487== 
==6487== 968 bytes in 121 blocks are indirectly lost in loss record 55 of 76
==6487==    at 0x4C2FA3F: malloc (in /usr/lib/valgrind/vgpreload_memcheck-amd64-linux.so)
==6487==    by 0x4C31D84: realloc (in /usr/lib/valgrind/vgpreload_memcheck-amd64-linux.so)
==6487==    by 0x4F37870: re_node_set_insert_last (regex_internal.c:1333)
==6487==    by 0x4F37870: calc_inveclosure (regcomp.c:1619)
==6487==    by 0x4F37870: analyze (regcomp.c:1198)
==6487==    by 0x4F37870: re_compile_internal (regcomp.c:793)
==6487==    by 0x4F3D331: regcomp (regcomp.c:498)
==6487==    by 0x10A0E2: get_usr (ls.c:419)
==6487==    by 0x109D9A: get_stat_out (ls.c:352)
==6487==    by 0x109BB1: output_ent_stats (ls.c:312)
==6487==    by 0x109562: _ls (ls.c:141)
==6487==    by 0x109178: main (ls.c:31)
==6487== 
==6487== 1,144 bytes in 22 blocks are indirectly lost in loss record 56 of 76
==6487==    at 0x4C31D2F: realloc (in /usr/lib/valgrind/vgpreload_memcheck-amd64-linux.so)
==6487==    by 0x4F2FA8A: re_node_set_merge (regex_internal.c:1194)
==6487==    by 0x4F2FA8A: calc_eclosure_iter (regcomp.c:1726)
==6487==    by 0x4F37713: calc_eclosure (regcomp.c:1659)
==6487==    by 0x4F37713: analyze (regcomp.c:1186)
==6487==    by 0x4F37713: re_compile_internal (regcomp.c:793)
==6487==    by 0x4F3D331: regcomp (regcomp.c:498)
==6487==    by 0x10A0E2: get_usr (ls.c:419)
==6487==    by 0x109D9A: get_stat_out (ls.c:352)
==6487==    by 0x109BB1: output_ent_stats (ls.c:312)
==6487==    by 0x109562: _ls (ls.c:141)
==6487==    by 0x109178: main (ls.c:31)
==6487== 
==6487== 1,200 bytes in 10 blocks are still reachable in loss record 57 of 76
==6487==    at 0x4C2FB0F: malloc (in /usr/lib/valgrind/vgpreload_memcheck-amd64-linux.so)
==6487==    by 0x4EBBB8B: getdelim (iogetdelim.c:62)
==6487==    by 0x10A17B: get_usr (ls.c:428)
==6487==    by 0x109D9A: get_stat_out (ls.c:352)
==6487==    by 0x109BB1: output_ent_stats (ls.c:312)
==6487==    by 0x109562: _ls (ls.c:141)
==6487==    by 0x109178: main (ls.c:31)
==6487== 
==6487== 1,408 bytes in 88 blocks are indirectly lost in loss record 58 of 76
==6487==    at 0x4C2FA3F: malloc (in /usr/lib/valgrind/vgpreload_memcheck-amd64-linux.so)
==6487==    by 0x4C31D84: realloc (in /usr/lib/valgrind/vgpreload_memcheck-amd64-linux.so)
==6487==    by 0x4F2A3BD: register_state (regex_internal.c:1570)
==6487==    by 0x4F2FDCC: create_ci_newstate (regex_internal.c:1638)
==6487==    by 0x4F2FDCC: re_acquire_state (regex_internal.c:1491)
==6487==    by 0x4F39BBA: add_epsilon_src_nodes (regexec.c:1775)
==6487==    by 0x4F39BBA: update_cur_sifted_state (regexec.c:1739)
==6487==    by 0x4F3A99E: sift_states_backward (regexec.c:1597)
==6487==    by 0x4F3C448: prune_impossible_nodes (regexec.c:971)
==6487==    by 0x4F3C448: re_search_internal (regexec.c:811)
==6487==    by 0x4F3D729: regexec@@GLIBC_2.3.4 (regexec.c:220)
==6487==    by 0x10A1AE: get_usr (ls.c:430)
==6487==    by 0x109D9A: get_stat_out (ls.c:352)
==6487==    by 0x109BB1: output_ent_stats (ls.c:312)
==6487==    by 0x109562: _ls (ls.c:141)
==6487== 
==6487== 1,540 bytes in 11 blocks are indirectly lost in loss record 59 of 76
==6487==    at 0x4C2FB0F: malloc (in /usr/lib/valgrind/vgpreload_memcheck-amd64-linux.so)
==6487==    by 0x4F36EC0: analyze (regcomp.c:1151)
==6487==    by 0x4F36EC0: re_compile_internal (regcomp.c:793)
==6487==    by 0x4F3D331: regcomp (regcomp.c:498)
==6487==    by 0x10A0E2: get_usr (ls.c:419)
==6487==    by 0x109D9A: get_stat_out (ls.c:352)
==6487==    by 0x109BB1: output_ent_stats (ls.c:312)
==6487==    by 0x109562: _ls (ls.c:141)
==6487==    by 0x109178: main (ls.c:31)
==6487== 
==6487== 1,584 bytes in 11 blocks are still reachable in loss record 60 of 76
==6487==    at 0x4C2FB0F: malloc (in /usr/lib/valgrind/vgpreload_memcheck-amd64-linux.so)
==6487==    by 0x10985F: get_ent_stats (ls.c:240)
==6487==    by 0x109472: _ls (ls.c:107)
==6487==    by 0x109178: main (ls.c:31)
==6487== 
==6487== 1,848 bytes in 77 blocks are indirectly lost in loss record 61 of 76
==6487==    at 0x4C31D2F: realloc (in /usr/lib/valgrind/vgpreload_memcheck-amd64-linux.so)
==6487==    by 0x4F37870: re_node_set_insert_last (regex_internal.c:1333)
==6487==    by 0x4F37870: calc_inveclosure (regcomp.c:1619)
==6487==    by 0x4F37870: analyze (regcomp.c:1198)
==6487==    by 0x4F37870: re_compile_internal (regcomp.c:793)
==6487==    by 0x4F3D331: regcomp (regcomp.c:498)
==6487==    by 0x10A0E2: get_usr (ls.c:419)
==6487==    by 0x109D9A: get_stat_out (ls.c:352)
==6487==    by 0x109BB1: output_ent_stats (ls.c:312)
==6487==    by 0x109562: _ls (ls.c:141)
==6487==    by 0x109178: main (ls.c:31)
==6487== 
==6487== 1,980 bytes in 66 blocks are indirectly lost in loss record 62 of 76
==6487==    at 0x4C2FB0F: malloc (in /usr/lib/valgrind/vgpreload_memcheck-amd64-linux.so)
==6487==    by 0x4F30512: re_node_set_init_copy (regex_internal.c:1023)
==6487==    by 0x4F30512: create_cd_newstate (regex_internal.c:1662)
==6487==    by 0x4F30512: re_acquire_state_context (regex_internal.c:1534)
==6487==    by 0x4F31259: build_trtable (regexec.c:3361)
==6487==    by 0x4F3C0B7: transit_state (regexec.c:2251)
==6487==    by 0x4F3C0B7: check_matching (regexec.c:1118)
==6487==    by 0x4F3C0B7: re_search_internal (regexec.c:790)
==6487==    by 0x4F3D729: regexec@@GLIBC_2.3.4 (regexec.c:220)
==6487==    by 0x10A1AE: get_usr (ls.c:430)
==6487==    by 0x109D9A: get_stat_out (ls.c:352)
==6487==    by 0x109BB1: output_ent_stats (ls.c:312)
==6487==    by 0x109562: _ls (ls.c:141)
==6487==    by 0x109178: main (ls.c:31)
==6487== 
==6487== 1,980 bytes in 66 blocks are indirectly lost in loss record 63 of 76
==6487==    at 0x4C2FB0F: malloc (in /usr/lib/valgrind/vgpreload_memcheck-amd64-linux.so)
==6487==    by 0x4F2A2C2: re_node_set_alloc (regex_internal.c:963)
==6487==    by 0x4F2A2C2: register_state (regex_internal.c:1555)
==6487==    by 0x4F306DC: create_cd_newstate (regex_internal.c:1714)
==6487==    by 0x4F306DC: re_acquire_state_context (regex_internal.c:1534)
==6487==    by 0x4F31259: build_trtable (regexec.c:3361)
==6487==    by 0x4F3C0B7: transit_state (regexec.c:2251)
==6487==    by 0x4F3C0B7: check_matching (regexec.c:1118)
==6487==    by 0x4F3C0B7: re_search_internal (regexec.c:790)
==6487==    by 0x4F3D729: regexec@@GLIBC_2.3.4 (regexec.c:220)
==6487==    by 0x10A1AE: get_usr (ls.c:430)
==6487==    by 0x109D9A: get_stat_out (ls.c:352)
==6487==    by 0x109BB1: output_ent_stats (ls.c:312)
==6487==    by 0x109562: _ls (ls.c:141)
==6487==    by 0x109178: main (ls.c:31)
==6487== 
==6487== 2,288 bytes in 88 blocks are indirectly lost in loss record 64 of 76
==6487==    at 0x4C31D2F: realloc (in /usr/lib/valgrind/vgpreload_memcheck-amd64-linux.so)
==6487==    by 0x4F3A224: re_node_set_merge (regex_internal.c:1194)
==6487==    by 0x4F3A224: add_epsilon_src_nodes (regexec.c:1786)
==6487==    by 0x4F3A224: update_cur_sifted_state (regexec.c:1739)
==6487==    by 0x4F3A99E: sift_states_backward (regexec.c:1597)
==6487==    by 0x4F3C448: prune_impossible_nodes (regexec.c:971)
==6487==    by 0x4F3C448: re_search_internal (regexec.c:811)
==6487==    by 0x4F3D729: regexec@@GLIBC_2.3.4 (regexec.c:220)
==6487==    by 0x10A1AE: get_usr (ls.c:430)
==6487==    by 0x109D9A: get_stat_out (ls.c:352)
==6487==    by 0x109BB1: output_ent_stats (ls.c:312)
==6487==    by 0x109562: _ls (ls.c:141)
==6487==    by 0x109178: main (ls.c:31)
==6487== 
==6487== 2,816 bytes in 11 blocks are definitely lost in loss record 65 of 76
==6487==    at 0x4C2FB0F: malloc (in /usr/lib/valgrind/vgpreload_memcheck-amd64-linux.so)
==6487==    by 0x4F3D2C9: regcomp (regcomp.c:479)
==6487==    by 0x10A0E2: get_usr (ls.c:419)
==6487==    by 0x109D9A: get_stat_out (ls.c:352)
==6487==    by 0x109BB1: output_ent_stats (ls.c:312)
==6487==    by 0x109562: _ls (ls.c:141)
==6487==    by 0x109178: main (ls.c:31)
==6487== 
==6487== 3,080 bytes in 11 blocks are still reachable in loss record 66 of 76
==6487==    at 0x4C2FB0F: malloc (in /usr/lib/valgrind/vgpreload_memcheck-amd64-linux.so)
==6487==    by 0x10A731: f_list_add_elem (f_list.c:105)
==6487==    by 0x10995D: get_ent_stats (ls.c:257)
==6487==    by 0x109472: _ls (ls.c:107)
==6487==    by 0x109178: main (ls.c:31)
==6487== 
==6487== 3,168 bytes in 11 blocks are indirectly lost in loss record 67 of 76
==6487==    at 0x4C2FB0F: malloc (in /usr/lib/valgrind/vgpreload_memcheck-amd64-linux.so)
==6487==    by 0x4F37793: analyze (regcomp.c:1195)
==6487==    by 0x4F37793: re_compile_internal (regcomp.c:793)
==6487==    by 0x4F3D331: regcomp (regcomp.c:498)
==6487==    by 0x10A0E2: get_usr (ls.c:419)
==6487==    by 0x109D9A: get_stat_out (ls.c:352)
==6487==    by 0x109BB1: output_ent_stats (ls.c:312)
==6487==    by 0x109562: _ls (ls.c:141)
==6487==    by 0x109178: main (ls.c:31)
==6487== 
==6487== 4,840 bytes in 55 blocks are indirectly lost in loss record 68 of 76
==6487==    at 0x4C31B25: calloc (in /usr/lib/valgrind/vgpreload_memcheck-amd64-linux.so)
==6487==    by 0x4F2FCB0: create_ci_newstate (regex_internal.c:1609)
==6487==    by 0x4F2FCB0: re_acquire_state (regex_internal.c:1491)
==6487==    by 0x4F39D3E: update_cur_sifted_state (regexec.c:1753)
==6487==    by 0x4F3A99E: sift_states_backward (regexec.c:1597)
==6487==    by 0x4F3C448: prune_impossible_nodes (regexec.c:971)
==6487==    by 0x4F3C448: re_search_internal (regexec.c:811)
==6487==    by 0x4F3D729: regexec@@GLIBC_2.3.4 (regexec.c:220)
==6487==    by 0x10A1AE: get_usr (ls.c:430)
==6487==    by 0x109D9A: get_stat_out (ls.c:352)
==6487==    by 0x109BB1: output_ent_stats (ls.c:312)
==6487==    by 0x109562: _ls (ls.c:141)
==6487==    by 0x109178: main (ls.c:31)
==6487== 
==6487== 5,808 bytes in 66 blocks are indirectly lost in loss record 69 of 76
==6487==    at 0x4C31B25: calloc (in /usr/lib/valgrind/vgpreload_memcheck-amd64-linux.so)
==6487==    by 0x4F304CA: create_cd_newstate (regex_internal.c:1659)
==6487==    by 0x4F304CA: re_acquire_state_context (regex_internal.c:1534)
==6487==    by 0x4F31259: build_trtable (regexec.c:3361)
==6487==    by 0x4F3C0B7: transit_state (regexec.c:2251)
==6487==    by 0x4F3C0B7: check_matching (regexec.c:1118)
==6487==    by 0x4F3C0B7: re_search_internal (regexec.c:790)
==6487==    by 0x4F3D729: regexec@@GLIBC_2.3.4 (regexec.c:220)
==6487==    by 0x10A1AE: get_usr (ls.c:430)
==6487==    by 0x109D9A: get_stat_out (ls.c:352)
==6487==    by 0x109BB1: output_ent_stats (ls.c:312)
==6487==    by 0x109562: _ls (ls.c:141)
==6487==    by 0x109178: main (ls.c:31)
==6487== 
==6487== 6,160 bytes in 11 blocks are indirectly lost in loss record 70 of 76
==6487==    at 0x4C2FB0F: malloc (in /usr/lib/valgrind/vgpreload_memcheck-amd64-linux.so)
==6487==    by 0x4F3690B: init_dfa (regcomp.c:841)
==6487==    by 0x4F3690B: re_compile_internal (regcomp.c:757)
==6487==    by 0x4F3D331: regcomp (regcomp.c:498)
==6487==    by 0x10A0E2: get_usr (ls.c:419)
==6487==    by 0x109D9A: get_stat_out (ls.c:352)
==6487==    by 0x109BB1: output_ent_stats (ls.c:312)
==6487==    by 0x109562: _ls (ls.c:141)
==6487==    by 0x109178: main (ls.c:31)
==6487== 
==6487== 6,160 bytes in 11 blocks are indirectly lost in loss record 71 of 76
==6487==    at 0x4C2FB0F: malloc (in /usr/lib/valgrind/vgpreload_memcheck-amd64-linux.so)
==6487==    by 0x4F36EE0: analyze (regcomp.c:1153)
==6487==    by 0x4F36EE0: re_compile_internal (regcomp.c:793)
==6487==    by 0x4F3D331: regcomp (regcomp.c:498)
==6487==    by 0x10A0E2: get_usr (ls.c:419)
==6487==    by 0x109D9A: get_stat_out (ls.c:352)
==6487==    by 0x109BB1: output_ent_stats (ls.c:312)
==6487==    by 0x109562: _ls (ls.c:141)
==6487==    by 0x109178: main (ls.c:31)
==6487== 
==6487== 6,160 bytes in 11 blocks are indirectly lost in loss record 72 of 76
==6487==    at 0x4C2FB0F: malloc (in /usr/lib/valgrind/vgpreload_memcheck-amd64-linux.so)
==6487==    by 0x4F36EEF: analyze (regcomp.c:1154)
==6487==    by 0x4F36EEF: re_compile_internal (regcomp.c:793)
==6487==    by 0x4F3D331: regcomp (regcomp.c:498)
==6487==    by 0x10A0E2: get_usr (ls.c:419)
==6487==    by 0x109D9A: get_stat_out (ls.c:352)
==6487==    by 0x109BB1: output_ent_stats (ls.c:312)
==6487==    by 0x109562: _ls (ls.c:141)
==6487==    by 0x109178: main (ls.c:31)
==6487== 
==6487== 7,744 bytes in 88 blocks are indirectly lost in loss record 73 of 76
==6487==    at 0x4C31B25: calloc (in /usr/lib/valgrind/vgpreload_memcheck-amd64-linux.so)
==6487==    by 0x4F2FCB0: create_ci_newstate (regex_internal.c:1609)
==6487==    by 0x4F2FCB0: re_acquire_state (regex_internal.c:1491)
==6487==    by 0x4F39BBA: add_epsilon_src_nodes (regexec.c:1775)
==6487==    by 0x4F39BBA: update_cur_sifted_state (regexec.c:1739)
==6487==    by 0x4F3A99E: sift_states_backward (regexec.c:1597)
==6487==    by 0x4F3C448: prune_impossible_nodes (regexec.c:971)
==6487==    by 0x4F3C448: re_search_internal (regexec.c:811)
==6487==    by 0x4F3D729: regexec@@GLIBC_2.3.4 (regexec.c:220)
==6487==    by 0x10A1AE: get_usr (ls.c:430)
==6487==    by 0x109D9A: get_stat_out (ls.c:352)
==6487==    by 0x109BB1: output_ent_stats (ls.c:312)
==6487==    by 0x109562: _ls (ls.c:141)
==6487==    by 0x109178: main (ls.c:31)
==6487== 
==6487== 11,264 bytes in 11 blocks are indirectly lost in loss record 74 of 76
==6487==    at 0x4C31B25: calloc (in /usr/lib/valgrind/vgpreload_memcheck-amd64-linux.so)
==6487==    by 0x4F3693F: init_dfa (regcomp.c:848)
==6487==    by 0x4F3693F: re_compile_internal (regcomp.c:757)
==6487==    by 0x4F3D331: regcomp (regcomp.c:498)
==6487==    by 0x10A0E2: get_usr (ls.c:419)
==6487==    by 0x109D9A: get_stat_out (ls.c:352)
==6487==    by 0x109BB1: output_ent_stats (ls.c:312)
==6487==    by 0x109562: _ls (ls.c:141)
==6487==    by 0x109178: main (ls.c:31)
==6487== 
==6487== 157,696 bytes in 77 blocks are indirectly lost in loss record 75 of 76
==6487==    at 0x4C31B25: calloc (in /usr/lib/valgrind/vgpreload_memcheck-amd64-linux.so)
==6487==    by 0x4F312FF: build_trtable (regexec.c:3396)
==6487==    by 0x4F3C0B7: transit_state (regexec.c:2251)
==6487==    by 0x4F3C0B7: check_matching (regexec.c:1118)
==6487==    by 0x4F3C0B7: re_search_internal (regexec.c:790)
==6487==    by 0x4F3D729: regexec@@GLIBC_2.3.4 (regexec.c:220)
==6487==    by 0x10A1AE: get_usr (ls.c:430)
==6487==    by 0x109D9A: get_stat_out (ls.c:352)
==6487==    by 0x109BB1: output_ent_stats (ls.c:312)
==6487==    by 0x109562: _ls (ls.c:141)
==6487==    by 0x109178: main (ls.c:31)
==6487== 
==6487== 240,372 (2,464 direct, 237,908 indirect) bytes in 11 blocks are definitely lost in loss record 76 of 76
==6487==    at 0x4C2FA3F: malloc (in /usr/lib/valgrind/vgpreload_memcheck-amd64-linux.so)
==6487==    by 0x4C31D84: realloc (in /usr/lib/valgrind/vgpreload_memcheck-amd64-linux.so)
==6487==    by 0x4F37CDB: re_compile_internal (regcomp.c:749)
==6487==    by 0x4F3D331: regcomp (regcomp.c:498)
==6487==    by 0x10A0E2: get_usr (ls.c:419)
==6487==    by 0x109D9A: get_stat_out (ls.c:352)
==6487==    by 0x109BB1: output_ent_stats (ls.c:312)
==6487==    by 0x109562: _ls (ls.c:141)
==6487==    by 0x109178: main (ls.c:31)
==6487== 
==6487== LEAK SUMMARY:
==6487==    definitely lost: 5,400 bytes in 23 blocks
==6487==    indirectly lost: 237,908 bytes in 1,848 blocks
==6487==      possibly lost: 0 bytes in 0 blocks
==6487==    still reachable: 8,720 bytes in 47 blocks
==6487==         suppressed: 0 bytes in 0 blocks
==6487== 
==6487== For counts of detected and suppressed errors, rerun with: -v
==6487== ERROR SUMMARY: 21 errors from 17 contexts (suppressed: 0 from 0)
